url	title
https://www.nytimes.com/2018/11/12/opinion/truth-virtue-trump-loyalty.html	Truth and Virtue in the Age of Trump
https://www.nytimes.com/2018/11/13/opinion/cultural-marxism-anti-semitism.html	The Alt-Right's Favorite Meme Is 100 Years Old
https://www.nytimes.com/2018/11/13/us/california-wildfires-war.html	Burned-Out Cars, Smoke in the Air, Aerial Assaults, All in California
https://www.nytimes.com/2018/11/11/us/california-fire-paradise.html	Forced Out by Deadly Fires, Then Trapped in Traffic
https://www.nytimes.com/2018/11/11/us/california-fires-how-to-help.html	How to Help Those Affected by the California Fires
https://www.apnews.com/39bf118b23f647debe40932ede2a243e	Wrapping up the holidays in an eco-friendly way
https://www.apnews.com/ac892e1c455743aa8d0a17eab863a384	Grim calculus: Coroners search for those killed in wildfire
https://www.bbc.com/news/health-46179175	Call for UK ban on 'grotesquely sugary' freakshakes
https://www.bbc.com/news/entertainment-arts-46186552	Stan Lee: Stars pay tribute to Marvel Comics pioneer, dead at 95